{
  "# CONSTRAINT TRADE-OFF": "JSON has no native comment syntax, so required file metadata is encoded as reserved metadata fields.",
  "__file": "pipeline/mapping-matrix.json",
  "__role": "Deterministic evidence-to-control mapping source for compliance reporting.",
  "__constraints_enforced": [
    "schema-bound-control-mapping",
    "pipeline-stage-traceability",
    "read-only-evidence-linkage"
  ],
  "__upstream": "sign-and-attest",
  "__downstream": "emit-trace-matrix",
  "$schema": "../schemas/mapping-matrix.schema.json",
  "generated_at_parameter": "INJECTED_FROM_PIPELINE_CONFIG",
  "framework_version": "ISM-2025-04 / E8-ML3-2025 / SOC2-2024",
  "mappings": [
    {
      "control_id": "CTRL-AUD-01",
      "control_description": "Cryptographic non-repudiation of all assurance outputs",
      "framework_refs": [
        "ISM-0149",
        "E8-ML3-APP-6",
        "SOC2-CC7.2"
      ],
      "evidence_artefact": "schemas/s-out.schema.json",
      "pipeline_stage": "sign-and-attest",
      "attestation_type": "cosign-keyless",
      "coverage_status": "COVERED"
    },
    {
      "control_id": "CTRL-SUPPLY-01",
      "control_description": "Software supply chain integrity via pinned digests and SBOM",
      "framework_refs": [
        "ISM-1753",
        "E8-ML3-PATCH-1",
        "SOC2-CC8.1"
      ],
      "evidence_artefact": "pipeline/outputs/sbom-cyclonedx.json",
      "pipeline_stage": "generate-sbom",
      "attestation_type": "cyclonedx-1.6",
      "coverage_status": "COVERED"
    },
    {
      "control_id": "CTRL-INFRA-01",
      "control_description": "Immutable, rootless, network-isolated container execution",
      "framework_refs": [
        "ISM-1491",
        "E8-ML3-APP-2",
        "SOC2-CC6.6"
      ],
      "evidence_artefact": "containers/governance-policy/Containerfile",
      "pipeline_stage": "evaluate-policies",
      "attestation_type": "conftest-opa",
      "coverage_status": "COVERED"
    },
    {
      "control_id": "CTRL-INPUT-01",
      "control_description": "Schema-bound, fail-fast input validation at all container boundaries",
      "framework_refs": [
        "ISM-0407",
        "E8-ML3-APP-3",
        "SOC2-CC6.1"
      ],
      "evidence_artefact": "schemas/s-in.schema.json",
      "pipeline_stage": "validate-inputs",
      "attestation_type": "jsonschema-2020-12",
      "coverage_status": "COVERED"
    },
    {
      "control_id": "CTRL-PROV-01",
      "control_description": "Verifiable build provenance linked to Git commit and workflow identity",
      "framework_refs": [
        "ISM-1858",
        "E8-ML3-APP-6",
        "SOC2-CC7.1"
      ],
      "evidence_artefact": "schemas/attestation.schema.json",
      "pipeline_stage": "sign-and-attest",
      "attestation_type": "slsa-provenance-v1",
      "coverage_status": "COVERED"
    },
    {
      "control_id": "CTRL-DETECT-01",
      "control_description": "Canary Token tripwires embedded in evidence artefacts for unauthorised access detection",
      "framework_refs": [
        "ISM-0140",
        "ISM-0585"
      ],
      "evidence_artefact": "pipeline/outputs/canary-placement-log.json",
      "pipeline_stage": "embed-canaries",
      "attestation_type": "canary-placement-log-v1",
      "coverage_status": "COVERED"
    },
    {
      "control_id": "CTRL-DETECT-02",
      "control_description": "Webhook tripwires on pipeline integrity events and canary callbacks, normalised to unified alert schema",
      "framework_refs": [
        "ISM-0109",
        "ISM-1554"
      ],
      "evidence_artefact": "pipeline/outputs/webhook-registration.json",
      "pipeline_stage": "register-webhooks",
      "attestation_type": "webhook-registration-v1",
      "coverage_status": "COVERED"
    },
    {
      "control_id": "CTRL-DETECT-03",
      "control_description": "SBOM access anomaly detection via Canary Token embedded in CycloneDX output",
      "framework_refs": [
        "ISM-1858"
      ],
      "evidence_artefact": "pipeline/outputs/sbom-cyclonedx.json",
      "pipeline_stage": "embed-canaries",
      "attestation_type": "canary-placement-log-v1",
      "coverage_status": "COVERED"
    },
    {
      "control_id": "CTRL-PAC-01",
      "control_description": "OPA/Conftest live evaluation of JSON policy object against Podman runtime configuration",
      "framework_refs": [
        "ISM-0149",
        "ISM-1491",
        "ISM-0407",
        "E8-ML3-APP-2",
        "SOC2-CC6.6"
      ],
      "evidence_artefact": "pipeline/outputs/pac-evaluation-result.json",
      "pipeline_stage": "evaluate-policies",
      "attestation_type": "conftest-opa-pac-v1",
      "coverage_status": "COVERED"
    },
    {
      "control_id": "CTRL-PAC-02",
      "control_description": "Azure Policy policyRule shape present and schema-valid; live evaluation out of pipeline scope",
      "framework_refs": [
        "ISM-1491",
        "E8-ML3-APP-2",
        "SOC2-CC6.6"
      ],
      "evidence_artefact": "policies/pac-policy.json",
      "pipeline_stage": "evaluate-policies",
      "attestation_type": "azure-policy-structural-v1",
      "coverage_status": "COVERAGE_STRUCTURAL_ONLY",
      "gap_note": "Live evaluation requires Azure Resource Manager API access. Requires cloud-bound runner configuration external to this pipeline."
    },
    {
      "control_id": "CTRL-PAC-03",
      "control_description": "AWS IAM/SCP Statement shape present and schema-valid; live evaluation out of pipeline scope",
      "framework_refs": [
        "ISM-1491",
        "E8-ML3-APP-2",
        "SOC2-CC8.1"
      ],
      "evidence_artefact": "policies/pac-policy.json",
      "pipeline_stage": "evaluate-policies",
      "attestation_type": "aws-iam-structural-v1",
      "coverage_status": "COVERAGE_STRUCTURAL_ONLY",
      "gap_note": "Live evaluation requires AWS STS credentials and account context. Requires cloud-bound runner configuration external to this pipeline."
    },
    {
      "control_id": "CTRL-TRACE-01",
      "control_description": "Multi-type Thinkst Canary Token deployment across full asset surface via flock-organised placement manifest",
      "framework_refs": [
        "ISM-0140",
        "ISM-0585",
        "ISM-0109"
      ],
      "evidence_artefact": "pipeline/outputs/tracebit-deployment-log.json",
      "pipeline_stage": "embed-canaries",
      "attestation_type": "tracebit-deployment-log-v1",
      "coverage_status": "COVERED"
    },
    {
      "control_id": "CTRL-TRACE-02",
      "control_description": "Structured reminder metadata on all tokens enabling forensic pinpointing of intrusion source",
      "framework_refs": [
        "ISM-0140",
        "ISM-1554"
      ],
      "evidence_artefact": "canary/tracebit-placement-manifest.json",
      "pipeline_stage": "embed-canaries",
      "attestation_type": "tracebit-reminder-schema-v1",
      "coverage_status": "COVERED"
    },
    {
      "control_id": "CTRL-TRACE-03",
      "control_description": "Alert severity routing across Slack, Grafana IRM, SIEM, and ticketing with acknowledge-first discipline",
      "framework_refs": [
        "ISM-0109",
        "ISM-1554"
      ],
      "evidence_artefact": "canary/alert-channels.json",
      "pipeline_stage": "register-webhooks",
      "attestation_type": "alert-channels-v1",
      "coverage_status": "COVERED"
    },
    {
      "control_id": "CTRL-TRACE-04",
      "control_description": "Token rotation and forensic archival enforced by pipeline run count \u2014 no clock dependency",
      "framework_refs": [
        "ISM-0140",
        "ISM-1858"
      ],
      "evidence_artefact": "pipeline/outputs/tracebit-rotation-log.json",
      "pipeline_stage": "embed-canaries",
      "attestation_type": "tracebit-rotation-log-v1",
      "coverage_status": "COVERED"
    },
    {
      "control_id": "CTRL-SLSA-01",
      "control_description": "SLSA Build Level 3 provenance generated by isolated trusted builder, linking build artefacts to Git commit and GitHub OIDC identity",
      "framework_refs": [
        "ISM-0149",
        "ISM-1753",
        "ISM-1858",
        "E8-ML3-PATCH-1",
        "SOC2-CC8.1"
      ],
      "evidence_artefact": "pipeline/outputs/provenance/assurance-platform.intoto.jsonl",
      "pipeline_stage": "slsa-provenance",
      "attestation_type": "slsa-build-level-3-generic-v2",
      "coverage_status": "COVERED"
    },
    {
      "control_id": "CTRL-SLSA-02",
      "control_description": "slsa-verifier confirms provenance integrity and trusted builder identity before evidence bundle packaging",
      "framework_refs": [
        "ISM-0149",
        "ISM-1753",
        "SOC2-CC7.2"
      ],
      "evidence_artefact": "pipeline/outputs/provenance/assurance-platform.intoto.jsonl",
      "pipeline_stage": "verify-provenance-and-tokens",
      "attestation_type": "slsa-verifier-pass",
      "coverage_status": "COVERED"
    },
    {
      "control_id": "CTRL-BUILD-CANARY-01",
      "control_description": "Canary Tokens embedded in SLSA provenance, SBOM, and evidence bundle post-signing to detect build output exfiltration",
      "framework_refs": [
        "ISM-0140",
        "ISM-0585",
        "ISM-1554"
      ],
      "evidence_artefact": "pipeline/outputs/tracebit-build-deployment-log.json",
      "pipeline_stage": "embed-canaries",
      "attestation_type": "tracebit-build-deployment-log-v1",
      "coverage_status": "COVERED"
    },
    {
      "control_id": "CTRL-RUNTIME-01",
      "control_description": "Runner tool versions verified against declared constants before any pipeline stage executes",
      "framework_refs": [
        "ISM-0407",
        "ISM-1491",
        "E8-ML3-APP-3"
      ],
      "evidence_artefact": "pipeline/outputs/runtime-verification.json",
      "pipeline_stage": "runtime-gate",
      "attestation_type": "runtime-verification-v1",
      "coverage_status": "COVERED"
    },
    {
      "control_id": "CTRL-RUNTIME-02",